{
  "$schema": "../schemas/release-operations.schema.json",
  "schemaVersion": 4,
  "independentReview": {
    "requiredForCandidate": true,
    "minimumApprovals": 1,
    "reviewerMustDifferFrom": ["pull-request-author", "candidate-actor"],
    "evidenceName": "independent-review.json"
  },
  "signing": {
    "allowedSignersFile": ".github/release-signers",
    "minimumActiveSigners": 1,
    "inventoryReviewedAt": "2026-07-16",
    "rotationReviewCadenceDays": 90,
    "overlapRequired": true,
    "lastRotationEvidence": null,
    "revocationProcedure": "Remove the signer through reviewed governance, revoke repository access, rotate overlapping keys, and create an incident record.",
    "lostKeyRecoveryProcedure": "Use a distinct authorized signer during the overlap window; if none remains, keep publication blocked pending owner restoration."
  },
  "recovery": {
    "workflow": ".github/workflows/release-recovery-drill.yml",
    "drillCadenceDays": 90,
    "lastSuccessfulDrill": null
  },
  "protectedPublication": {
    "environment": "release",
    "externalApprovalRequired": true,
    "evidenceMaxAgeDays": 90,
    "currentEvidence": null
  },
  "candidateObservation": {
    "minimumHours": 168,
    "timestampSource": "github-releases-api-published-at",
    "requirePublishedPrerelease": true
  },
  "labels": {
    "source": ".github/labels.yml",
    "workflow": ".github/workflows/pr-governance.yml",
    "mode": "create-update-no-delete"
  }
}
